[
  {
    "id": "consultants_lesson_01_role_modern_hair_restoration",
    "programId": "program_certificate_consultation_patient_coordination",
    "levelId": "level_consultants_foundation_certificate",
    "moduleId": "consultants_module_01_role_modern_hair_restoration",
    "slug": "role-and-scope-in-modern-hair-restoration-clinics",
    "title": "Role and Scope in Modern Hair Restoration Clinics",
    "sequence": 1,
    "status": "draft",
    "estimatedStudyMinutes": 10,
    "overview": "Drawn from Teaching Manual Volume 1 (Week 1): positions the consultant and nurse as clinical-support professionals in a coordinated, doctor-led hair restoration pathway—not as a sales front end. You will connect the modern clinic, role boundaries, the end-to-end patient journey, and what excellence means when trust and safety are the outcomes.",
    "learningObjectives": [
      "Explain why first-contact staff materially affect safety, trust, and efficiency before the doctor encounter",
      "Contrast coordinated, handover-ready care with fragmented or pressure-led pathways",
      "List consultant/nurse support tasks (inform, screen, document, escalate) versus doctor-led diagnosis, suitability, and consent",
      "Map the typical patient journey and identify communication or process failure points and appropriate corrective actions"
    ],
    "body": {
      "format": "richText",
      "content": "## Purpose and front-line impact\n\nTeaching Manual Volume 1, Week 1 purpose: move from marketing-minded first-contact habits to a clinical support mindset that protects patients, builds durable trust, and strengthens the doctor-led pathway.\n\nThe first-contact team is not decorative. In contemporary hair restoration, coordinators and nurses structure the pre-doctor journey, reduce anxiety, limit misunderstanding, and ensure the treating clinician receives accurate, neutral information. Weak first contact fragments care, increases confusion, and leaves patients feeling sold to rather than supported.\n\n## One pathway, distinct roles\n\nThink of the clinic as an integrated system. Administration, coordinators, nurses, and doctors have distinct duties, but the patient should experience one coherent pathway. Information must flow cleanly between roles. Within your organisation’s protocols, you may educate generally, gather structured history, screen against agreed criteria, document objectively, and escalate concerns; you do not replace medical assessment, prescribing, or informed consent.\n\n## State your role plainly\n\nPatients routinely conflate roles. State yours plainly: you help structure the visit, explain process, capture concerns and history for the doctor, and answer non-clinical or general questions only as authorised. You do not independently diagnose hair loss, confirm suitability for surgery, promise outcomes, or substitute for the doctor’s clinical decision-making.\n\n## Journey checkpoints and consultation excellence\n\nMap the typical journey: enquiry, screening or triage contact, consultation preparation, clinician encounter, decision support, treatment-day coordination, and follow-up. At each stage, ask where trust can fail (vague promises, missed red flags, rushed booking) and what corrective behaviour looks like.\n\nConsultation excellence in this program means coordination, empathy, accuracy, ethical restraint, and seamless handover—not persuading someone to book. Practice activity (Volume 1): sketch a patient-journey map from first enquiry through follow-up; mark at least five points where clarity, safety, or trust could fail and note the corrective action you would take within scope."
    },
    "patientCommunicationExamples": [
      {
        "id": "pc_01",
        "title": "Scope-safe opening language",
        "example": "My role is to help structure your consultation, explain the process clearly, and ensure the doctor receives accurate information.",
        "rationale": "Frames support clearly without implying clinical authority."
      },
      {
        "id": "pc_01b",
        "title": "Redirecting diagnosis or guarantee requests",
        "example": "I hear that you want a clear answer today. I am not able to diagnose or confirm a treatment plan—that is for your doctor after they review you. I can make sure your concerns and history are captured completely so nothing important is missed.",
        "rationale": "Validates the patient, restates boundaries, and preserves doctor-led decision-making."
      },
      {
        "id": "pc_01c",
        "title": "Integrated pathway wording",
        "example": "Our team works in steps so you have one consistent pathway: I focus on preparation and documentation, then the doctor focuses on medical assessment and options. That way your decisions are based on a full clinical review.",
        "rationale": "Reinforces coordinated care without overstating non-doctor authority."
      }
    ],
    "roleBoundaryNotes": [
      {
        "id": "rb_01",
        "title": "No independent diagnosis",
        "note": "Consultants and nurses do not diagnose hair loss conditions or scalp disease independently. Use neutral observation and documentation; clinical interpretation belongs to the doctor."
      },
      {
        "id": "rb_01b",
        "title": "Support is not a substitute for the clinician",
        "note": "Efficiency gains from structured support must never collapse into false clinical authority. Booking pressure, premature suitability statements, and consent shortcuts are out of scope."
      }
    ],
    "keyTakeaways": [
      "First-contact work is a safety and trust lever, not only an administrative layer.",
      "Patients experience one clinic; your job is to connect roles through clear handover, not to close a sale.",
      "Excellence is measured by accurate preparation, ethical restraint, and doctor-ready documentation.",
      "Volume 1 Week 1 maps directly onto this module; ethics and professional responsibility are deepened later in the dedicated Ethics and Scope module (Level 2), aligned with Volume 1 Week 2."
    ],
    "redFlags": [
      "Non-doctor staff implying or stating a diagnosis",
      "Guarantees of density, outcome, or suitability before doctor review",
      "Pressure-led booking or consent before clinician assessment",
      "Fragmented information so the doctor receives an incomplete or biased picture",
      "Dismissive handling of patient anxiety or questions"
    ],
    "escalationTriggers": [
      {
        "id": "et_01",
        "title": "Scope breach risk",
        "trigger": "Patient requests diagnostic certainty, suitability confirmation, or treatment decisions from non-doctor staff.",
        "action": "Escalate to the responsible doctor or regulated clinician; document the request neutrally."
      },
      {
        "id": "et_01b",
        "title": "Expectations locked in before clinical review",
        "trigger": "Patient has been given strong outcome or treatment promises elsewhere in the pathway, or believes a decision is already final.",
        "action": "Do not reinforce the promise. Clarify process, ensure accurate handover, and involve the clinician or senior lead per protocol."
      }
    ],
    "evidenceTier": {
      "overall": "consensus",
      "summaryNote": "Role clarity is primarily standards-led and governance-based.",
      "notes": []
    },
    "facultyNoteIds": ["consultants_note_scope_language", "consultants_note_volume1_week1_faculty"],
    "complianceNoticeIds": [
      "notice_consultants_competency_scope",
      "notice_consultants_no_diagnostic_authority"
    ],
    "referenceIds": ["consultants_reference_01"],
    "resourceIds": ["consultants_resource_01"],
    "assessmentIds": ["consultants_assessment_01_role_modern_hair_restoration"],
    "caseStudyIds": ["consultants_case_01_role_modern_hair_restoration"],
    "practicalTaskIds": [],
    "completionRules": [
      {
        "id": "complete_01_view",
        "type": "view",
        "description": "Complete the lesson reading.",
        "required": true
      },
      {
        "id": "complete_01_assessment",
        "type": "pass-linked-assessment",
        "description": "Pass the linked module assessment.",
        "required": true
      }
    ],
    "displayFlags": {
      "showEvidencePanel": true,
      "showRedFlagsPanel": true,
      "showEscalationPanel": true,
      "showFacultyNotes": false,
      "showCompliancePanel": true
    }
  },
  {
    "id": "consultants_lesson_02_foundations_hair_scalp_science",
    "programId": "program_certificate_consultation_patient_coordination",
    "levelId": "level_consultants_foundation_certificate",
    "moduleId": "consultants_module_02_foundations_hair_scalp_science",
    "slug": "foundational-hair-and-scalp-literacy",
    "title": "Foundational Hair and Scalp Literacy",
    "sequence": 2,
    "status": "draft",
    "estimatedStudyMinutes": 10,
    "overview": "Aligned with Teaching Manual Volume 1 (Week 3: hair and scalp science foundations). Builds follicle- and cycle-level literacy, density versus calibre concepts, and pattern vocabulary so you can educate in plain language, document neutrally, and hand over to the doctor without diagnostic overreach. Ethics, scope, and consent are deepened in the Level 2 Ethics and Scope module (Volume 1 Week 2 themes).",
    "learningObjectives": [
      "Describe hair follicle structure and the growth cycle (anagen, catagen, telogen) in patient-friendly terms",
      "Contrast hair density and hair calibre and explain why apparent thinning can occur while hairs are still shed normally",
      "Recognise common non-scarring alopecia pattern descriptions at an educational literacy level without assigning a diagnosis",
      "Translate scientific concepts into calm, bounded communication and neutral documentation for clinician review"
    ],
    "body": {
      "format": "richText",